1304520927456108544,2020-09-11 20:43:20,Standard Tweet,"I support Medicare for All.
I support a Green New Deal.
I support Paid Sick Leave.
I support Universal Basic Income.
I support putting people over profits.

My opponent, Tony Cardenas, supports none of the these. 

It's time for change. #AngelicaBeatsTony https://t.co/kbEYBIUIlI",Angelica Dueñas for Congress 🍞🌹☮🌎,Angelica4CA,1222586478,275,812,[],['AngelicaBeatsTony'],[],photo,['http://pbs.twimg.com/media/EhqWz1VVgAA6m5D.jpg'],,,,,,,,,[],[],,,[],,,,,,04Oct20_144748,medicare green deal paid sick leave universal basic income putting people profits opponent tony cardenas supports none time angelicabeatstony,"['medicar', 'green', 'deal', 'paid', 'sick', 'leav', 'univers', 'basic', 'incom', 'put', 'peopl', 'profit', 'oppon', 'toni', 'cardena', 'support', 'none', 'time', 'angelicabeatstoni']"
1295069730420662273,2020-08-16 18:47:39,Reply Tweet,"The Club didn't come to a consensus, but that's okay because YOU are what's going to help us win this election.

We are creating an unstoppable people-powered movement fighting for Medicare for All, a Green New Deal, UBI, and Housing as a Right! 

Join Us!
https://t.co/FrKHBgBNxa",Angelica Dueñas for Congress 🍞🌹☮🌎,Angelica4CA,1222586478,23,139,['https://www.angelica4congress.com/volunteer'],[],[],,[],1.2950691685306696e+18,,,Angelica4CA,1222586478.0,,,,[],[],,,[],,,,,,04Oct20_144749,club didnt come consensus thats okay whats going help win election creating unstoppable peoplepowered movement fighting medicare green deal ubi housing right,"['club', 'didnt', 'come', 'consensus', 'that', 'okay', 'what', 'go', 'help', 'win', 'elect', 'creat', 'unstopp', 'peoplepow', 'movement', 'fight', 'medicar', 'green', 'deal', 'ubi', 'hous', 'right']"
1251924670762242053,2020-04-19 17:24:35,Retweet,"Our new website is up and running! 
Check it out!
https://t.co/Gy3nHDC1rK 

#MedicareForAll #GreenNewDeal #HousingForAll #FreeHigherEd #NoMoreWar #CorporateFree #CA29",Angelica Dueñas for Congress 🍞🌹☮🌎,Angelica4CA,1222586478,4,16,['http://Angelica4congress.com'],"['MedicareForAll', 'GreenNewDeal', 'HousingForAll', 'FreeHigherEd', 'NoMoreWar', 'CorporateFree', 'CA29']",[],,[],1.2513613018314465e+18,Sat Apr 18 04:05:58 +0000 2020,Angelica Dueñas for Congress 🍞🌹☮🌎,Angelica4CA,1222586478.0,,,,[],[],,,[],,,,,,04Oct20_144750,website running check medicareforall greennewdeal housingforall freehighered nomorewar corporatefree ca29,"['websit', 'run', 'check', 'medicareforal', 'greennewd', 'housingforal', 'freehigh', 'nomorewar', 'corporatefre', 'ca29']"
1238163190040514565,2020-03-12 18:01:23,Retweet,"Madre, esposa e hija de inmigrantes. Lista para luchar por nuestra comunidad, manteniendo unidas a las familias y el futuro de nuestros hijos. Done y sea voluntario:
https://t.co/l5lVEStKPA 
#SFV #CA29 #Angelica4Congress #AngeliCARES #Vote2020  #GreenNewDeal #MedicareParaTodos https://t.co/dlgaMeiTbb",Angelica Dueñas for Congress 🍞🌹☮🌎,Angelica4CA,1222586478,4,9,['http://angelica4congress.com'],"['SFV', 'CA29', 'Angelica4Congress', 'AngeliCARES', 'Vote2020', 'GreenNewDeal', 'MedicareParaTodos']",[],video,['http://pbs.twimg.com/ext_tw_video_thumb/1170145876188094465/pu/img/l75llQY7VRewSdz3.jpg'],1.170147801881174e+18,Sat Sep 07 01:32:30 +0000 2019,Angelica Dueñas for Congress 🍞🌹☮🌎,Angelica4CA,1222586478.0,,,,[],[],,,[],,,,,,04Oct20_144751,madre esposa e hija inmigrantes lista para luchar por nuestra comunidad manteniendo unidas las familias el futuro nuestros hijos done sea voluntario sfv ca29 angelica4congress angelicares vote2020 greennewdeal medicareparatodos,"['madr', 'esposa', 'hija', 'inmigrant', 'lista', 'para', 'luchar', 'por', 'nuestra', 'comunidad', 'manteniendo', 'unida', 'las', 'familia', 'el', 'futuro', 'nuestro', 'hijo', 'done', 'sea', 'voluntario', 'sfv', 'ca29', 'angelica4congress', 'angelicar', 'vote2020', 'greennewd', 'medicareparatodo']"
1228366049591955456,2020-02-14 17:11:02,Standard Tweet,"We are 100% People Powered ✊🏽
Can you donate $14 today? 
https://t.co/Fs4CtSo0jg
Help get a voice of justice to Congress!!
--
#29 #GreenNewDeal #MedicareForAll #Vote2020 #Bernie2020 #Love #ShowTheLove #donate #fundraising https://t.co/rdgE4BY2mJ",Angelica Dueñas for Congress 🍞🌹☮🌎,Angelica4CA,1222586478,2,5,['http://Angelica4congress.com/donate'],"['GreenNewDeal', 'MedicareForAll', 'Vote2020', 'Bernie2020', 'Love', 'ShowTheLove', 'donate', 'fundraising']",[],photo,['http://pbs.twimg.com/media/EQwIZ9XVAAE52i5.jpg'],,,,,,,,,[],[],,,[],,,,,,04Oct20_144751,100 people powered donate 14 help voice justice congress 29 greennewdeal medicareforall vote2020 bernie2020 love showthelove donate fundraising,"['peopl', 'power', 'donat', 'help', 'voic', 'justic', 'congress', 'greennewd', 'medicareforal', 'vote2020', 'bernie2020', 'love', 'showthelov', 'donat', 'fundrais']"
1228186155209773063,2020-02-14 05:16:12,Standard Tweet,"Proudly endorsed by @OurRevolutionLA  
#CA29 #GreenNewDeal #MedicareForAll #GND #Bernie2020 #Vote #Vote2020 https://t.co/OznwOfbrlx",Angelica Dueñas for Congress 🍞🌹☮🌎,Angelica4CA,1222586478,2,6,[],"['CA29', 'GreenNewDeal', 'MedicareForAll', 'GND', 'Bernie2020', 'Vote', 'Vote2020']","[{'screen_name': 'OurRevolutionLA', 'name': 'Our Revolution: Los Angeles', 'id': 1019782707897745408, 'id_str': '1019782707897745408', 'indices': [20, 36]}]",photo,['http://pbs.twimg.com/media/EQtky8DUUAA9x7R.jpg'],,,,,,,,,[],[],,,[],,,,,,04Oct20_144751,proudly endorsed ourrevolutionla ca29 greennewdeal medicareforall gnd bernie2020 vote vote2020,"['proud', 'endors', 'ourrevolutionla', 'ca29', 'greennewd', 'medicareforal', 'gnd', 'bernie2020', 'vote', 'vote2020']"
1222548514112077824,2020-01-29 15:54:14,Quote Tweet,This is who incumbent @RepCardenas (member of #NewDemocratCoalition ) has endorsed in the #2020presidentialelection #awkward #GreenNewDeal #MedicareParaTodos #MedicareForAll #affordablehousing #Vote #CA29 #SFV https://t.co/zellanQZaf,Angelica Dueñas for Congress 🍞🌹☮🌎,Angelica4CA,1222586478,2,3,['https://twitter.com/ZaidJilani/status/1222258335342366721'],"['NewDemocratCoalition', '2020presidentialelection', 'awkward', 'GreenNewDeal', 'MedicareParaTodos', 'MedicareForAll', 'affordablehousing', 'Vote', 'CA29', 'SFV']","[{'screen_name': 'RepCardenas', 'name': 'Rep. Tony Cárdenas', 'id': 1222257180, 'id_str': '1222257180', 'indices': [22, 34]}]",,[],,,,,,,,,[],[],,,[],,,,,,04Oct20_144751,incumbent repcardenas member newdemocratcoalition endorsed 2020presidentialelection awkward greennewdeal medicareparatodos medicareforall affordablehousing vote ca29 sfv,"['incumb', 'repcardena', 'member', 'newdemocratcoalit', 'endors', 'presidentialelect', 'awkward', 'greennewd', 'medicareparatodo', 'medicareforal', 'affordableh', 'vote', 'ca29', 'sfv']"
1318266842813661184,2020-10-19 19:04:42,Retweet,#AngelicaForUs @Angelica4CA supports a #GreenNewDeal. We have to clean up our act. We must transition to a net zero carbon power infrastructure. This will create thousands of good paying jobs and help mitigate the damage already done by climate change. https://t.co/RZ1g0RG49Q https://t.co/NAa0xgmcBR,Angelica Dueñas for Congress 🍞🌹☮🌎,Angelica4CA,1222586478,10,9,['http://www.angelica4congress.com/donate'],"['AngelicaForUs', 'GreenNewDeal']","[{'screen_name': 'Angelica4CA', 'name': 'Angelica Dueñas for Congress 🍞🌹☮🌎', 'id': 1222586478, 'id_str': '1222586478', 'indices': [15, 27]}]",photo,['http://pbs.twimg.com/media/EktXTMxXEAMzBsq.jpg'],1.3182666673828332e+18,Mon Oct 19 19:04:00 +0000 2020,What's hard about this? #BlackLivesMatter,Repugnantclowns,8.335092281365053e+17,,,,[],[],,,[],,,,,,20Oct20_092914,angelicaforus angelica4ca supports greennewdeal clean act transition net zero carbon power infrastructure create thousands good paying jobs help mitigate damage already done,"['angelicaforus', 'angelica4ca', 'support', 'greennewd', 'clean', 'act', 'transit', 'net', 'zero', 'carbon', 'power', 'infrastructur', 'creat', 'thousand', 'good', 'pay', 'job', 'help', 'mitig', 'damag', 'alreadi', 'done']"
1314747063511392256,2020-10-10 01:58:21,Standard Tweet,"This moment calls for structural change.

Tune into RISE Los Angeles by @SunriseMvmtLA right now to help push local progressives to victory!

Together, we will fight for a Green New Deal in the halls of Congress, City Hall, and the State Capital.
https://t.co/40XL3FPeba",Angelica Dueñas for Congress 🍞🌹☮🌎,Angelica4CA,1222586478,16,28,['https://secure.actblue.com/donate/sunriselacandidates'],[],"[{'screen_name': 'SunriseMvmtLA', 'name': 'Sunrise Movement LA 🌅', 'id': 1069071870194941953, 'id_str': '1069071870194941953', 'indices': [72, 86]}]",,[],,,,,,,,,[],[],,,[],,,,,,20Oct20_092914,moment calls structural tune rise los angeles sunrisemvmtla right help push local progressives victory together fight green deal halls congress city hall capital,"['moment', 'call', 'structur', 'tune', 'rise', 'los', 'angel', 'sunrisemvmtla', 'right', 'help', 'push', 'local', 'progress', 'victori', 'togeth', 'fight', 'green', 'deal', 'hall', 'congress', 'citi', 'hall', 'capit']"
1312987569425014784,2020-10-05 05:26:45,Retweet,"Medicare for All cannot wait.
A Green New Deal cannot wait.
Housing for All cannot wait.
Getting Money Out of Politics cannot wait.

We need representatives who will fight for us in Congress!

Donate $10 RIGHT NOW! Let's do this! #AngelicaMoneyBomb
https://t.co/YiTYxkbtAd",Angelica Dueñas for Congress 🍞🌹☮🌎,Angelica4CA,1222586478,30,64,['https://secure.actblue.com/donate/mmail29'],['AngelicaMoneyBomb'],[],,[],1.3117791879302267e+18,Thu Oct 01 21:25:04 +0000 2020,Angelica Dueñas for Congress 🍞🌹☮🌎,Angelica4CA,1222586478.0,,,,[],[],,,[],,,,,,20Oct20_092914,medicare cannot wait green deal cannot wait housing cannot wait getting money politics cannot wait representatives fight congress donate 10 right lets angelicamoneybomb,"['medicar', 'cannot', 'wait', 'green', 'deal', 'cannot', 'wait', 'hous', 'cannot', 'wait', 'get', 'money', 'polit', 'cannot', 'wait', 'repres', 'fight', 'congress', 'donat', 'right', 'let', 'angelicamoneybomb']"
1311132359895527426,2020-09-30 02:34:48,Standard Tweet,"A simple explainer for Trump to follow:

Climate change =&gt; more droughts 
More droughts =&gt; sick trees 
Sick trees =&gt; bark beetle infestation 
Bark beetle infestation =&gt; millions of dead trees
Millions of dead trees =&gt; more forest fires 🔥 

#ClimateChangeIsReal #Debate2020",Jimmy Gomez,JimmyGomezCA,398193180,4,21,[],"['ClimateChangeIsReal', 'Debate2020']",[],,[],,,,,,,,,[],[],,,[],,,,,,04Oct20_144808,simple explainer trump follow gt droughts droughts gt sick trees sick trees gt bark beetle infestation bark beetle infestation gt millions dead trees millions dead trees gt forest fires climatechangeisreal debate2020,"['simpl', 'explain', 'trump', 'follow', 'gt', 'drought', 'drought', 'gt', 'sick', 'tree', 'sick', 'tree', 'gt', 'bark', 'beetl', 'infest', 'bark', 'beetl', 'infest', 'gt', 'million', 'dead', 'tree', 'million', 'dead', 'tree', 'gt', 'forest', 'fire', 'climatechangeisr', 'debate2020']"
1305890206332067847,2020-09-15 15:24:22,Retweet,It actually won’t get cooler Mr. President. #ClimateChangeIsReal https://t.co/gYWtitBdcN,Jimmy Gomez,JimmyGomezCA,398193180,731,2296,[],['ClimateChangeIsReal'],[],photo,['http://pbs.twimg.com/media/Eh5e1ChVgAA17Ob.jpg'],1.305585232507056e+18,Mon Sep 14 19:12:30 +0000 2020,Wade Crowfoot,WadeCrowfoot,2324445042.0,,,,[],[],,,[],,,,,,04Oct20_144808,actually wont cooler mr president climatechangeisreal,"['actual', 'wont', 'cooler', 'mr', 'presid', 'climatechangeisr']"
1305641437006934016,2020-09-14 22:55:50,Retweet,"The hots are getting hotter.

The dries are getting drier.

The evidence is all around us -- climate change is REAL. https://t.co/2Ww2THctTJ",Jimmy Gomez,JimmyGomezCA,398193180,5919,28982,[],[],[],video,['http://pbs.twimg.com/media/Eh5aqOcXcAAKbjw.jpg'],1.305603675021144e+18,Mon Sep 14 20:25:47 +0000 2020,Gavin Newsom,GavinNewsom,11347122.0,,,,[],[],,,[],,,,,,04Oct20_144808,hots getting hotter dries getting drier evidence around real,"['hot', 'get', 'hotter', 'dri', 'get', 'drier', 'evid', 'around', 'real']"
1235102365952258048,2020-03-04 07:18:45,Standard Tweet,"I’m humbled by your support tonight! If you believe in protecting Medicare &amp; Social Security, fighting for middle class families, LGBTQ &amp; women's rights, fighting for climate justice, &amp; standing up for veterans, then join us! It is an honor to have you by my side! https://t.co/PeAcRGczYL",Dr. Raul Ruiz,Dr_RaulRuiz,409522947,3,11,[],[],[],photo,['http://pbs.twimg.com/media/ESPFOW4UYAAf3co.jpg'],,,,,,,,,[],[],,,[],,,,,,04Oct20_144834,humbled tonight believe protecting medicare social security fighting middle class families lgbtq womens rights fighting justice standing veterans honor side,"['humbl', 'tonight', 'believ', 'protect', 'medicar', 'social', 'secur', 'fight', 'middl', 'class', 'famili', 'lgbtq', 'women', 'right', 'fight', 'justic', 'stand', 'veteran', 'honor', 'side']"
1295394638749036550,2020-08-17 16:18:43,Standard Tweet,"The third-highest temperature ever recorded on the surface of the earth just came out of southern California.

But yeah, forget about our slashing methane regulation, lowering fuel efficiency standards, and leaving the Paris Accord. No problems here!

https://t.co/gFkqH6RAkX",Liam O'Mara for Congress,LiamOMaraIV,1561703689,8,23,['https://www.nbcnews.com/news/weather/heatwave-continues-across-west-death-valley-hits-record-breaking-130-n1236915'],[],[],,[],,,,,,,,,[],[],,,[],,,,,,04Oct20_144901,thirdhighest temperature ever recorded surface earth came southern yeah forget slashing methane regulation lowering fuel efficiency standards leaving paris accord problems,"['thirdhighest', 'temperatur', 'ever', 'record', 'surfac', 'earth', 'came', 'southern', 'yeah', 'forget', 'slash', 'methan', 'regul', 'lower', 'fuel', 'effici', 'standard', 'leav', 'pari', 'accord', 'problem']"
1284853431253954562,2020-07-19 14:11:44,Quote Tweet,"This could be us, but we keep electing fools with no vision, who would rather serve the fossil fuel industry than the American people. Think about it: Just one hour to Las Vegas!
#HighSpeedRail #GreenNewDeal https://t.co/3qotTYRs7F",Liam O'Mara for Congress,LiamOMaraIV,1561703689,23,97,['https://twitter.com/sunrisemvmt/status/1284658003455737856'],"['HighSpeedRail', 'GreenNewDeal']",[],,[],1.2846580034557379e+18,Sun Jul 19 01:15:10 +0000 2020,Sunrise Movement 🌅,sunrisemvmt,1880725393.0,"you ever just think about the high speed rail system :,) https://t.co/FrRtWBvXIn",5930.0,40118.0,[],[],[],photo,['http://pbs.twimg.com/media/EdQFpOAWsAISFP6.jpg'],,,,,,04Oct20_144902,could keep electing fools vision would rather serve fossil fuel industry american people think hour las vegas highspeedrail greennewdeal,"['could', 'keep', 'elect', 'fool', 'vision', 'would', 'rather', 'serv', 'fossil', 'fuel', 'industri', 'american', 'peopl', 'think', 'hour', 'las', 'vega', 'highspeedrail', 'greennewd']"
1234233142392676352,2020-03-01 21:44:46,Standard Tweet,"Since folks in both parties keep misrepresenting the Green New Deal (no, it doesn't ban 'planes, ACs, or farts!), recently AOC read the resolution on the House floor. Please listen &amp; tell me why getting good jobs, housing, and infrastructure sounds scary.

https://t.co/7h4RQ1xhvs",Liam O'Mara for Congress,LiamOMaraIV,1561703689,7,39,['https://youtu.be/24Dlqdyhjqw'],[],[],,[],,,,,,,,,[],[],,,[],,,,,,04Oct20_144905,since folks parties keep misrepresenting green deal doesnt ban planes acs farts recently aoc read resolution house floor please listen tell getting good jobs housing infrastructure sounds scary,"['sinc', 'folk', 'parti', 'keep', 'misrepres', 'green', 'deal', 'doesnt', 'ban', 'plane', 'ac', 'fart', 'recent', 'aoc', 'read', 'resolut', 'hous', 'floor', 'pleas', 'listen', 'tell', 'get', 'good', 'job', 'hous', 'infrastructur', 'sound', 'scari']"
1306736194554867714,2020-09-17 23:26:01,Standard Tweet,"There's no time to delay climate action -- the climate crisis is here now.
https://t.co/wualY1k7gh",Alan Lowenthal,alanlowenthal,562232053,0,2,['https://bit.ly/2Ru3Q5S'],[],[],,[],,,,,,,,,[],[],,,[],,,,,,04Oct20_144931,theres time delay action crisis,"['there', 'time', 'delay', 'action', 'crisi']"
1282694282307084289,2020-07-13 15:12:02,Standard Tweet,"“It’s a confirmation of the power of organizing and of staying the course in the intertwined fight for racial and climate justice.”
https://t.co/9odWKZi6B6",Alan Lowenthal,alanlowenthal,562232053,0,1,['https://bit.ly/3fsCsPK'],[],[],,[],,,,,,,,,[],[],,,[],,,,,,04Oct20_144931,confirmation power organizing staying course intertwined fight racial justice,"['confirm', 'power', 'organ', 'stay', 'cours', 'intertwin', 'fight', 'racial', 'justic']"
1278413709535297537,2020-07-01 19:42:34,Retweet,"My new post: the House Select Committee on the Climate Crisis has, after a year of meetings &amp; testimony, issued its recommendations. They constitute the most detailed plan yet for reaching net-zero emissions by 2050 — &amp; a glaring contrast with GOP policy. https://t.co/40zkRDLJ3E",Mike Levin,MikeLevin,14573926,274,564,['https://www.vox.com/energy-and-environment/2020/6/30/21305891/climate-change-house-democrats-select-committee-report?utm_campaign=drvox&utm_content=chorus&utm_medium=social&utm_source=twitter'],[],[],,[],1.2779659569169736e+18,Tue Jun 30 14:03:22 +0000 2020,David Roberts,drvox,22737278.0,,,,[],[],,,[],,,,,,04Oct20_144948,post house select committee crisis meetings testimony issued recommendations constitute detailed plan yet reaching netzero emissions 2050 glaring contrast gop policy,"['post', 'hous', 'select', 'committe', 'crisi', 'meet', 'testimoni', 'issu', 'recommend', 'constitut', 'detail', 'plan', 'yet', 'reach', 'netzero', 'emiss', 'glare', 'contrast', 'gop', 'polici']"
1245101295083520000,2020-03-31 21:30:56,Retweet,"We've seen all too terribly the consequences of those who denied warnings of a pandemic. We can't afford any more consequences of climate denial. All of us, especially young people, have to demand better of our government at every level and vote this fall. https://t.co/K8Ucu7iVDK",Mike Levin,MikeLevin,14573926,89395,336806,['https://www.latimes.com/politics/story/2020-03-31/trump-rolls-back-fuel-economy-standards'],[],[],,[],1.2450077133875446e+18,Tue Mar 31 15:19:04 +0000 2020,Barack Obama,BarackObama,813286.0,,,,[],[],,,[],,,,,,04Oct20_144950,weve seen terribly consequences denied warnings pandemic afford consequences denial especially young people demand better government every level vote fall,"['weve', 'seen', 'terribl', 'consequ', 'deni', 'warn', 'pandem', 'afford', 'consequ', 'denial', 'especi', 'young', 'peopl', 'demand', 'better', 'govern', 'everi', 'level', 'vote', 'fall']"
1227352437683392512,2020-02-11 22:03:18,Retweet,"We're endorsing @ACampaNajjar for #CA50! We need pro-environment leaders in Congress to #ActOnClimate.

Do you know who you're voting for in the #CAPrimary?

Check out our full slate of endorsements here 👉🏽https://t.co/l9wAePw98r https://t.co/1ASuoH5Jui",Ammar Campa-Najjar,ACampaNajjar,274440617,14,29,['https://www.ecovote.org/elections/current-endorsements/'],"['CA50', 'ActOnClimate', 'CAPrimary']","[{'screen_name': 'ACampaNajjar', 'name': 'Ammar Campa-Najjar', 'id': 274440617, 'id_str': '274440617', 'indices': [16, 29]}]",photo,['http://pbs.twimg.com/media/EQg_4dnUEAIndDd.jpg'],1.227306308686082e+18,Tue Feb 11 19:00:00 +0000 2020,CLCV 🌎,clcv,18795726.0,,,,[],[],,,[],,,,,,04Oct20_145004,endorsing acampanajjar ca50 proenvironment leaders congress actonclimate know youre voting caprimary check slate endorsements,"['endors', 'acampanajjar', 'ca50', 'proenviron', 'leader', 'congress', 'actonclim', 'know', 'your', 'vote', 'caprimari', 'check', 'slate', 'endors']"
1301959032324980738,2020-09-04 19:03:17,Standard Tweet,"Need a reminder that the #ClimateCrisis is real? Look at the catastrophic heat, storms, and wildfires affecting California and other states.

I was a community organizer fighting to address environmental justice and I'm committed to fighting for the #GreenNewDeal in Congress. 🌎",Georgette Gómez,SDGeorgette,41873707,4,15,[],"['ClimateCrisis', 'GreenNewDeal']",[],,[],,,,,,,,,[],[],,,[],,,,,,04Oct20_145015,reminder climatecrisis real catastrophic heat storms wildfires affecting states community organizer fighting address environmental justice committed fighting greennewdeal congress,"['remind', 'climatecrisi', 'real', 'catastroph', 'heat', 'storm', 'wildfir', 'affect', 'state', 'communiti', 'organ', 'fight', 'address', 'environment', 'justic', 'commit', 'fight', 'greennewd', 'congress']"
1231256255613689857,2020-02-22 16:35:41,Retweet,"Trump and his enablers decry policies like Medicare for All and a Green New Deal as “socialist,” but have no problem handing out massive federal aid to farmers who have been hit by Trump’s pointless trade war.

Their hypocrisy is staggering.",Georgette Gómez,SDGeorgette,41873707,2183,6303,[],[],[],,[],1.2312553271248077e+18,Sat Feb 22 16:32:00 +0000 2020,Robert Reich,RBReich,148529707.0,,,,[],[],,,[],,,,,,04Oct20_145016,trump enablers decry policies medicare green deal socialist problem handing massive federal aid farmers hit trumps pointless trade war hypocrisy staggering,"['trump', 'enabl', 'decri', 'polici', 'medicar', 'green', 'deal', 'socialist', 'problem', 'hand', 'massiv', 'feder', 'aid', 'farmer', 'hit', 'trump', 'pointless', 'trade', 'war', 'hypocrisi', 'stagger']"
1228385056474849282,2020-02-14 18:26:34,Reply Tweet,@sdclimateaction Why we must vote Yes on A!,Georgette Gómez,SDGeorgette,41873707,0,5,[],[],"[{'screen_name': 'sdclimateaction', 'name': 'CAC', 'id': 2940099270, 'id_str': '2940099270', 'indices': [0, 16]}]",,[],1.228373074665296e+18,,,sdclimateaction,2940099270.0,,,,[],[],,,[],,,,,,04Oct20_145017,sdclimateaction vote yes,"['sdclimateact', 'vote', 'yes']"
1322342676528812032,2020-10-31 01:00:36,Standard Tweet,"I'm deeply committed to protecting our environment, fighting climate change, and moving toward 100% clean energy. I'm grateful to be endorsed by @SierraClub and look forward to working in Congress to build the political will we need to see to tackle the climate crisis. #CA53 https://t.co/aroYm9VoXd",Georgette Gómez,SDGeorgette,41873707,3,20,[],['CA53'],"[{'screen_name': 'SierraClub', 'name': 'Sierra Club', 'id': 34113439, 'id_str': '34113439', 'indices': [145, 156]}]",photo,['http://pbs.twimg.com/media/Elnnp9IXIAEpSY_.jpg'],,,,,,,,,[],[],,,[],,,,,,03Nov20_210901,deeply committed protecting environment fighting moving toward 100 clean energy grateful endorsed sierraclub forward working congress build political tackle crisis ca53,"['deepli', 'commit', 'protect', 'environ', 'fight', 'move', 'toward', 'clean', 'energi', 'grate', 'endors', 'sierraclub', 'forward', 'work', 'congress', 'build', 'polit', 'tackl', 'crisi', 'ca53']"
1252974148093194241,2020-04-22 14:54:50,Standard Tweet,"Climate change is one of the biggest threats we face, but Washington has failed to act &amp; our young people will be forced to live with the consequences. We need to send a new generation of leaders to Congress who will address climate change with the urgency it requires. #EarthDay https://t.co/Za93zgWl4i",Sara Jacobs,SaraJacobsCA,1656913327,4,14,[],['EarthDay'],[],photo,['http://pbs.twimg.com/media/EWN1K8xWsAEOAXe.jpg'],,,,,,,,,[],[],,,[],,,,,,04Oct20_145028,biggest threats face failed act young people forced live consequences send generation leaders congress address urgency requires earthday,"['biggest', 'threat', 'face', 'fail', 'act', 'young', 'peopl', 'forc', 'live', 'consequ', 'send', 'generat', 'leader', 'congress', 'address', 'urgenc', 'requir', 'earthday']"
1201985766785769472,2019-12-03 22:05:13,Retweet,Our delegation was honored to have an audience with H.M. King Felipe VI at Zarzuela Palace this morning where we discussed the strong ties between our two great nations and our shared commitment to addressing the climate crisis as Spain hosts #COP25. #TimeForAction https://t.co/M9IYeSq9VL,Joe Neguse,JoeNeguse,1542372750,1878,10648,[],"['COP25', 'TimeForAction']",[],photo,"['http://pbs.twimg.com/media/EK2z_Q8XYAUJd6t.jpg', 'http://pbs.twimg.com/media/EK2z_UJX0AA_6Av.jpg', 'http://pbs.twimg.com/media/EK2z_Q7WoAAYywN.jpg']",1.2018146043572634e+18,Tue Dec 03 10:45:04 +0000 2019,Nancy Pelosi,SpeakerPelosi,15764644.0,,,,[],[],,,[],,,,,,04Oct20_145054,delegation honored audience hm king felipe vi zarzuela palace morning discussed strong ties two great nations shared commitment addressing crisis spain hosts cop25 timeforaction,"['deleg', 'honor', 'audienc', 'hm', 'king', 'felip', 'vi', 'zarzuela', 'palac', 'morn', 'discuss', 'strong', 'tie', 'two', 'great', 'nation', 'share', 'commit', 'address', 'crisi', 'spain', 'host', 'cop25', 'timeforact']"
1291825971289452544,2020-08-07 19:58:07,Standard Tweet,"While my opponent tweets about hot button national issues, our farmers and ranchers are suffering. 

My opponent has NO plan to conserve our water and openly mocks calls to action on climate.

They deserve better. 
https://t.co/xMeKgvfwiG",Diane Mitsch Bush for Congress,RepDMB,2364682111,77,208,['https://www.washingtonpost.com/graphics/2020/national/climate-environment/climate-change-colorado-utah-hot-spot/?utm_campaign=wp_post_most&utm_medium=email&utm_source=newsletter&wpisrc=nl_most'],[],[],,[],,,,,,,,,[],[],,,[],,,,,,04Oct20_145058,opponent tweets hot button national issues farmers ranchers suffering opponent plan conserve water openly mocks calls action deserve better,"['oppon', 'tweet', 'hot', 'button', 'nation', 'issu', 'farmer', 'rancher', 'suffer', 'oppon', 'plan', 'conserv', 'water', 'open', 'mock', 'call', 'action', 'deserv', 'better']"
