1320733878051454981,2020-10-26 14:27:49,Standard Tweet,"I’m a Biden Climate voter because I know @JoeBiden
will take climate change seriously by rejoining the Paris Accord and investing in renewable energy to create millions of jobs for Americans.

Join me by becoming a Biden Climate Voter. Sign up below. ⬇️

https://t.co/fPHabL7avj",Deb Haaland,Deb4CongressNM,286476728,20,120,['https://go.joebiden.com/page/s/biden-climate-voters'],[],"[{'screen_name': 'JoeBiden', 'name': 'Joe Biden', 'id': 939091, 'id_str': '939091', 'indices': [41, 50]}]",,[],,,,,,,,,[],[],,,[],,,,,,03Nov20_211200,biden voter know joebiden seriously rejoining paris accord investing renewable energy create millions jobs americans becoming biden voter sign,"['biden', 'voter', 'know', 'joebiden', 'serious', 'rejoin', 'pari', 'accord', 'invest', 'renew', 'energi', 'creat', 'million', 'job', 'american', 'becom', 'biden', 'voter', 'sign']"
1319467597671272448,2020-10-23 02:36:04,Standard Tweet,"I sit on @JoeBiden's Climate Engagement Advisory Council, and I know Joe cares about our communities and our earth. Under a #BidenHarris2020 administration, we will address Climate Change and invest in renewable energy to create clean good-paying jobs. #Debate2020",Deb Haaland,Deb4CongressNM,286476728,62,407,[],"['BidenHarris2020', 'Debate2020']","[{'screen_name': 'JoeBiden', 'name': 'Joe Biden', 'id': 939091, 'id_str': '939091', 'indices': [9, 18]}]",,[],,,,,,,,,[],[],,,[],,,,,,03Nov20_211200,sit joebidens engagement advisory council know joe cares communities earth bidenharris2020 administration address invest renewable energy create clean goodpaying jobs debate2020,"['sit', 'joebiden', 'engag', 'advisori', 'council', 'know', 'joe', 'care', 'communiti', 'earth', 'bidenharris2020', 'administr', 'address', 'invest', 'renew', 'energi', 'creat', 'clean', 'goodpay', 'job', 'debate2020']"
1305620755258855424,2020-09-14 21:33:39,Standard Tweet,"I’m joining @LatinoRebels and @ClimatePower for a Latino climate town hall this THURSDAY. Don't miss it! Join me alongside:

@Jamie_Margolin
@ThisIsZeroHour
@yeampierre
@UPROSE
@Julito77, Latino Rebels
@Cristela9, comedian and actress
 
RSVP here: https://t.co/KqXVIsti5Q https://t.co/MKdWfrWZ1w",Teresa Leger Fernandez,TeresaForNM,1128147829606600706,8,18,['http://cp2020.link/latino-town-hall'],[],"[{'screen_name': 'latinorebels', 'name': 'Latino Rebels', 'id': 249217178, 'id_str': '249217178', 'indices': [12, 25]}, {'screen_name': 'ClimatePower', 'name': 'Climate Power', 'id': 28657802, 'id_str': '28657802', 'indices': [30, 43]}, {'screen_name': 'Jamie_Margolin', 'name': 'Jamie Margolin', 'id': 810585618031984640, 'id_str': '810585618031984640', 'indices': [125, 140]}, {'screen_name': 'ThisIsZeroHour', 'name': 'Zero Hour', 'id': 887468509021732865, 'id_str': '887468509021732865', 'indices': [141, 156]}, {'screen_name': 'yeampierre', 'name': 'Elizabeth Yeampierre', 'id': 422104815, 'id_str': '422104815', 'indices': [157, 168]}, {'screen_name': 'UPROSE', 'name': 'UPROSE', 'id': 50413725, 'id_str': '50413725', 'indices': [169, 176]}, {'screen_name': 'julito77', 'name': 'Julio Ricardo Varela', 'id': 17050431, 'id_str': '17050431', 'indices': [177, 186]}, {'screen_name': 'cristela9', 'name': 'Cristela Alonzo', 'id': 1018971566162444289, 'id_str': '1018971566162444289', 'indices': [202, 212]}]",video,['http://pbs.twimg.com/ext_tw_video_thumb/1305620539973591040/pu/img/8b8J5QZnDPcu8tWM.jpg'],,,,,,,,,[],[],,,[],,,,,,04Oct20_155003,joining latinorebels climatepower latino town hall thursday miss alongside jamie_margolin thisiszerohour yeampierre uprose julito77 latino rebels cristela9 comedian actress rsvp,"['join', 'latinorebel', 'climatepow', 'latino', 'town', 'hall', 'thursday', 'miss', 'alongsid', 'jamie_margolin', 'thisiszerohour', 'yeampierr', 'upros', 'julito77', 'latino', 'rebel', 'cristela9', 'comedian', 'actress', 'rsvp']"
1258090695253872641,2020-05-06 17:46:10,Quote Tweet,"Thank you, @RSChamberNV for putting this together!

Let’s:
✅ build on the ACA &amp; create a universal healthcare system that works for all
✅ address climate change, bring green jobs to NV, &amp; align housing/climate goals
✅ reverse economic inequality 

https://t.co/YYQKsvTtYe https://t.co/vXpwKcgvVQ",Patricia Ackerman for Congress,PAckermanNV,918193319552876544,2,1,"['http://ackerman4congress.com', 'https://twitter.com/RSChamberNV/status/1258065043012251650']",[],"[{'screen_name': 'RSChamberNV', 'name': 'Reno+Sparks Chamber of Commerce', 'id': 107483934, 'id_str': '107483934', 'indices': [11, 23]}]",,[],1.2580650430122516e+18,Wed May 06 16:04:14 +0000 2020,Reno+Sparks Chamber of Commerce,RSChamberNV,107483934.0,"Voting matters, now more than ever. We asked candidates from some key offices to participate in our Online Candidate Forum: a series of videos highlighting each candidate's platform, and how they plan to respond to the #COVID19 crisis. Watch now: https://t.co/WB2LS3o6gh",0.0,13.0,['https://www.youtube.com/playlist?list=PLkbpyiJTMIuASNj4SHSeb-Wb_PfHM4MDW'],['COVID19'],[],,[],,,,,,04Oct20_154812,thank rschambernv putting together lets build aca create universal healthcare system works address green jobs align housingclimate goals reverse economic inequality,"['thank', 'rschambernv', 'put', 'togeth', 'let', 'build', 'aca', 'creat', 'univers', 'healthcar', 'system', 'work', 'address', 'green', 'job', 'align', 'housingclim', 'goal', 'revers', 'econom', 'inequ']"
1255882100248465408,2020-04-30 15:30:00,Standard Tweet,"Wondering how to make a difference from home? Here are some great tips on how to reduce your carbon footprint at home:
https://t.co/77MKNV6pEk",Susie Lee,SusieLeeNV,602919981,1,0,['https://www.curbed.com/2020/4/22/21228477/climate-change-stop-home-solutions-coronavirus?fbclid=IwAR03gWkfT_aInnsoQVgbOzJ-N-Wf8vSI1remqbB-wcfu2yrVb7db9HWPHBs'],[],[],,[],,,,,,,,,[],[],,,[],,,,,,04Oct20_154814,wondering difference home great tips reduce carbon footprint home,"['wonder', 'differ', 'home', 'great', 'tip', 'reduc', 'carbon', 'footprint', 'home']"
1253075606293614599,2020-04-22 21:38:00,Standard Tweet,"Grateful for our beautiful planet &amp; everyone on it this #EarthDay. 

COVID-19 has painfully shown us that we can't ignore a problem until it shuts down the economy &amp; costs American lives. 

The climate crisis is not on pause. We need #ClimateActionNow to protect our way of life. https://t.co/p4kwqHdObK",Susie Lee,SusieLeeNV,602919981,1,3,[],"['EarthDay', 'ClimateActionNow']",[],photo,['http://pbs.twimg.com/media/EWPNAIGUcAA3B-e.jpg'],,,,,,,,,[],[],,,[],,,,,,04Oct20_154814,grateful beautiful planet everyone earthday covid19 painfully shown ignore problem shuts economy costs american lives crisis pause climateactionnow protect way life,"['grate', 'beauti', 'planet', 'everyon', 'earthday', 'covid19', 'pain', 'shown', 'ignor', 'problem', 'shut', 'economi', 'cost', 'american', 'live', 'crisi', 'paus', 'climateactionnow', 'protect', 'way', 'life']"
1199138357932122113,2019-11-26 01:30:38,Standard Tweet,"As a combat veteran, an educator, and an elected official I have made public service the cornerstone of my career. Whether it’s health care, job creation or combatting climate change, #NY02 deserves a member of Congress who will stand with New Yorkers.

https://t.co/AlE4RVyrz5",Jackie Gordon,VoteJackie4NY,1122921580210921474,4,38,['https://www.nytimes.com/2019/11/25/nyregion/lara-trump-congress-ny-lazio.html'],['NY02'],[],,[],,,,,,,,,[],[],,,[],,,,,,04Oct20_155142,combat veteran educator elected official made public service cornerstone career whether health care job creation combatting ny02 deserves member congress stand yorkers,"['combat', 'veteran', 'educ', 'elect', 'offici', 'made', 'public', 'servic', 'cornerston', 'career', 'whether', 'health', 'care', 'job', 'creation', 'combat', 'ny02', 'deserv', 'member', 'congress', 'stand', 'yorker']"
1320696461827461122,2020-10-26 11:59:08,Standard Tweet,"I am happy to endorse @Ngoroff - “A Scientist with Solutions!” Here are three good reasons to support Nancy - Trump, SALT, and climate.",Tom Suozzi,Tom_Suozzi,18907639,7,30,[],[],"[{'screen_name': 'ngoroff', 'name': 'Nancy Goroff for Congress', 'id': 44518306, 'id_str': '44518306', 'indices': [22, 30]}]",,[],,,,,,,,,[],[],,,[],,,,,,03Nov20_211226,happy endorse ngoroff scientist solutions three good reasons nancy trump salt,"['happi', 'endors', 'ngoroff', 'scientist', 'solut', 'three', 'good', 'reason', 'nanci', 'trump', 'salt']"
1217943851278782465,2020-01-16 22:56:57,RT of QT,"Congress is not legislating the reduction of CO2 + methane emissions required to save our planet and preserve our way of life.

It’s a complete abdication of responsibility for our future.

&amp; Even as nations burn before us, politicians seem to think we have time. We must act now. https://t.co/RZ2m7YqYqt",Nydia M Velázquez,ReElectNydia,721127537674489856,4066,18943,['https://twitter.com/nytclimate/status/1217778610792280064'],[],[],,[],1.2178324221312737e+18,Thu Jan 16 15:34:10 +0000 2020,Alexandria Ocasio-Cortez,AOC,138203134.0,"""if you look at must-pass legislation, this Congress is engaged in climate denial,” says 
@AOC https://t.co/Y2CWZSbdNr",371.0,1675.0,['https://nyti.ms/2u4RU1G'],[],"[{'screen_name': 'AOC', 'name': 'Alexandria Ocasio-Cortez', 'id': 138203134, 'id_str': '138203134', 'indices': [90, 94]}]",,[],1.21777861079228e+18,Thu Jan 16 12:00:20 +0000 2020,NYT Climate,nytclimate,14603515.0,04Oct20_155307,congress legislating reduction co2 methane emissions required save planet preserve way life complete abdication responsibility future even nations burn politicians seem think time act,"['congress', 'legisl', 'reduct', 'co2', 'methan', 'emiss', 'requir', 'save', 'planet', 'preserv', 'way', 'life', 'complet', 'abdic', 'respons', 'futur', 'even', 'nation', 'burn', 'politician', 'seem', 'think', 'time', 'act']"
1311131168453132291,2020-09-30 02:30:04,Standard Tweet,"When Republicans talk about the Green New Deal being 100 trillion dollars, please know they‘re doing that Dr. Evil thing where they shout random, escalating numbers to sound ominous.

See for yourself. It’s written so you don’t need a law degree to read: https://t.co/clcSqyQDqy",Alexandria Ocasio-Cortez,AOC,138203134,24868,102138,['https://www.congress.gov/116/bills/hres109/BILLS-116hres109ih.pdf'],[],[],,[],,,,,,,,,[],[],,,[],,,,,,04Oct20_155036,republicans green deal 100 trillion dollars please know theyre dr evil shout random escalating numbers sound ominous written law degree read,"['republican', 'green', 'deal', 'trillion', 'dollar', 'pleas', 'know', 'theyr', 'dr', 'evil', 'shout', 'random', 'escal', 'number', 'sound', 'omin', 'written', 'law', 'degre', 'read']"
1254858587031179264,2020-04-27 19:42:55,Reply Tweet,"Primary results matters beyond who wins 1st place. Sen. Sanders explicitly stated that he intended on continuing to collect delegates in order to advance wage, healthcare, climate &amp; other priorities into the platform at the convention.

The @DNC should respond to this decision.",Alexandria Ocasio-Cortez,AOC,138203134,1565,10799,[],[],"[{'screen_name': 'DNC', 'name': 'Democratic Party', 'id': 722793491059769344, 'id_str': '722793491059769344', 'indices': [245, 249]}]",,[],1.2548575285060854e+18,,,AOC,138203134.0,,,,[],[],,,[],,,,,,04Oct20_155038,primary results matters beyond wins 1st place sen sanders explicitly stated intended continuing collect delegates order advance wage healthcare priorities platform convention dnc respond decision,"['primari', 'result', 'matter', 'beyond', 'win', 'st', 'place', 'sen', 'sander', 'explicit', 'state', 'intend', 'continu', 'collect', 'deleg', 'order', 'advanc', 'wage', 'healthcar', 'prioriti', 'platform', 'convent', 'dnc', 'respond', 'decis']"
1239604300281757696,2020-03-16 17:27:50,Standard Tweet,"What we should seriously start to consider now for the medium &amp; long term (bc it will take time) is New Deal-style policy.

We need a mix of policies to help put a lot of people to work. Climate transition, edu expansion w/ apprenticeships &amp; colleges, M4A.

These are jobs bills.",Alexandria Ocasio-Cortez,AOC,138203134,2859,17620,[],[],[],,[],,,,,,,,,[],[],,,[],,,,,,04Oct20_155040,seriously start consider medium long term bc time dealstyle policy mix policies help put lot people work transition edu expansion w apprenticeships colleges m4a jobs bills,"['serious', 'start', 'consid', 'medium', 'long', 'term', 'bc', 'time', 'dealstyl', 'polici', 'mix', 'polici', 'help', 'put', 'lot', 'peopl', 'work', 'transit', 'edu', 'expans', 'apprenticeship', 'colleg', 'm4a', 'job', 'bill']"
1232504896173334528,2020-02-26 03:17:20,Standard Tweet,Not a single climate change question. Horrifying.,Alexandria Ocasio-Cortez,AOC,138203134,18866,196696,[],[],[],,[],,,,,,,,,[],[],,,[],,,,,,04Oct20_155040,single question horrifying,"['singl', 'question', 'horrifi']"
1213978914709786625,2020-01-06 00:21:42,Quote Tweet,"Remember when everyone mocked us for saying that fighting climate change is going to take a WWII-scale mobilization?

Well, it’s already starting to happen.

The question is: will we mobilize reactively to destruction, or will we act proactively for prevention? #GreenNewDeal https://t.co/nfTjuTJ13U",Alexandria Ocasio-Cortez,AOC,138203134,14377,66825,['https://twitter.com/nytimes/status/1213746992909889536'],['GreenNewDeal'],[],,[],1.2137469929098895e+18,Sun Jan 05 09:00:08 +0000 2020,The New York Times,nytimes,807095.0,"The Australian government has announced a large-scale use of military assets, a deployment not seen since World War II, as fires continue to spread
https://t.co/vo19HoPAot",2909.0,6551.0,['https://nyti.ms/2ZQBcPu'],[],[],,[],,,,,,04Oct20_155041,remember everyone mocked saying fighting going wwiiscale mobilization well already starting happen question mobilize reactively destruction act proactively prevention greennewdeal,"['rememb', 'everyon', 'mock', 'say', 'fight', 'go', 'wwiiscal', 'mobil', 'well', 'alreadi', 'start', 'happen', 'question', 'mobil', 'reactiv', 'destruct', 'act', 'proactiv', 'prevent', 'greennewd']"
1198348721991376911,2019-11-23 21:12:54,Retweet,"Climate change activists stormed the field at the Yale-Harvard football game on Saturday afternoon, disrupting the game at halftime to call for the universities to divest their investments in fossil fuels https://t.co/zzlFprWMzm",Alexandria Ocasio-Cortez,AOC,138203134,5430,26693,['https://nyti.ms/2OcR4aQ'],[],[],,[],1.198327884202619e+18,Sat Nov 23 19:50:06 +0000 2019,The New York Times,nytimes,807095.0,,,,[],[],,,[],,,,,,04Oct20_155041,activists stormed field yaleharvard football game saturday afternoon disrupting game halftime call universities divest investments fossil fuels,"['activist', 'storm', 'field', 'yaleharvard', 'footbal', 'game', 'saturday', 'afternoon', 'disrupt', 'game', 'halftim', 'call', 'univers', 'divest', 'invest', 'fossil', 'fuel']"
1191783610883411969,2019-11-05 18:25:29,Quote Tweet,"When it comes to the climate crisis, tweaks and shortcuts aren’t enough to preserve our planet.

Massive, systemic change is in alignment with scientific consensus.

We need #GreenNewDeal. https://t.co/mNSUmGeC3X",Alexandria Ocasio-Cortez,AOC,138203134,5364,26569,['https://twitter.com/HuffPost/status/1191735901212364800'],['GreenNewDeal'],[],,[],1.1917359012123648e+18,Tue Nov 05 15:15:54 +0000 2019,HuffPost,HuffPost,14511951.0,"More than 11,000 scientists from 153 countries warn in a new report that the changing climate will cause “untold human suffering” without drastic action. https://t.co/GzrRVydn6v",8908.0,11615.0,['http://huffp.st/xvpEbWe'],[],[],,[],,,,,,04Oct20_155041,comes crisis tweaks shortcuts arent enough preserve planet massive systemic alignment scientific consensus greennewdeal,"['come', 'crisi', 'tweak', 'shortcut', 'arent', 'enough', 'preserv', 'planet', 'massiv', 'system', 'align', 'scientif', 'consensus', 'greennewd']"
1315064870354780160,2020-10-10 23:01:12,Retweet,"At the #NewYorkerFest, @AOC and @ewarren discussed the need to address climate change, how young people’s politics are being shaped by the tumult of 2020, and what happens if President Trump refuses to accept the election results. https://t.co/u4Rbygbgy6",Alexandria Ocasio-Cortez,AOC,138203134,1109,7343,['http://nyer.cm/zyW3sn6'],['NewYorkerFest'],"[{'screen_name': 'AOC', 'name': 'Alexandria Ocasio-Cortez', 'id': 138203134, 'id_str': '138203134', 'indices': [23, 27]}, {'screen_name': 'ewarren', 'name': 'Elizabeth Warren', 'id': 357606935, 'id_str': '357606935', 'indices': [32, 40]}]",,[],1.315053764064301e+18,Sat Oct 10 22:17:04 +0000 2020,The New Yorker,NewYorker,14677919.0,,,,[],[],,,[],,,,,,20Oct20_093346,newyorkerfest aoc ewarren discussed address young peoples politics shaped tumult 2020 happens president trump refuses accept election results,"['newyorkerfest', 'aoc', 'ewarren', 'discuss', 'address', 'young', 'peopl', 'polit', 'shape', 'tumult', 'happen', 'presid', 'trump', 'refus', 'accept', 'elect', 'result']"
1319701824866320387,2020-10-23 18:06:48,Standard Tweet,"It’s #FireDrillFriday!

@Janefonda is throwing down for a Green New Deal today and I’m excited to join her as we discuss the path forward for our future 🌎 

https://t.co/gQPADhUH0e",Alexandria Ocasio-Cortez,AOC,138203134,757,8557,['https://www.pscp.tv/w/cmHAjjFQWEVkbWFPbVlyUWV8MXlwS2R3a1lOanJ4V9TnWl7u5GzwBuzhfxNNb3ozGTM4b2iVYf1X__tzBbFo'],['FireDrillFriday'],"[{'screen_name': 'Janefonda', 'name': 'Jane Seymour Fonda', 'id': 18583722, 'id_str': '18583722', 'indices': [24, 34]}]",,[],,,,,,,,,[],[],,,[],,,,,,03Nov20_211206,firedrillfriday janefonda throwing green deal excited discuss path forward future,"['firedrillfriday', 'janefonda', 'throw', 'green', 'deal', 'excit', 'discuss', 'path', 'forward', 'futur']"
1275891063715246080,2020-06-24 20:38:29,Retweet,"In a new oped, @jnoisecat and @RitchieTorres make the case for electrifying and retrofitting NYCHA to create clean energy jobs, address climate change and fight pollution. https://t.co/xPfDZyNOa2",Ritchie Torres,RitchieTorres,1247612029,33,95,['https://crooked.com/articles/fight-coronavirus-climate-change/'],[],"[{'screen_name': 'jnoisecat', 'name': 'Julian Brave NoiseCat', 'id': 3305651181, 'id_str': '3305651181', 'indices': [15, 25]}, {'screen_name': 'RitchieTorres', 'name': 'Ritchie Torres', 'id': 1247612029, 'id_str': '1247612029', 'indices': [30, 44]}]",,[],1.2758908614868664e+18,Wed Jun 24 20:37:40 +0000 2020,Data for Progress,DataProgress,9.570244413384172e+17,,,,[],[],,,[],,,,,,04Oct20_155051,oped jnoisecat ritchietorres case electrifying retrofitting nycha create clean energy jobs address fight pollution,"['ope', 'jnoisecat', 'ritchietorr', 'case', 'electrifi', 'retrofit', 'nycha', 'creat', 'clean', 'energi', 'job', 'address', 'fight', 'pollut']"
1283752965900304384,2020-07-16 13:18:52,Reply Tweet,"New York State has the highest levels of income inequality in the nation — and until we address that Black and Latinx families will continue to bear the unjust burden of crises that disproportionately affect poor communities like COVID, police violence, and climate change. https://t.co/NbZcliiPgc",Jamaal Bowman,JamaalBowmanNY,1138076821533155328,125,463,[],[],[],photo,['http://pbs.twimg.com/media/EdDOhJPX0AER5wY.jpg'],1.283751654806958e+18,,,JamaalBowmanNY,1.1380768215331553e+18,,,,[],[],,,[],,,,,,04Oct20_155105,york highest levels income inequality nation address black latinx families continue bear unjust burden crises disproportionately affect poor communities covid police violence,"['york', 'highest', 'level', 'incom', 'inequ', 'nation', 'address', 'black', 'latinx', 'famili', 'continu', 'bear', 'unjust', 'burden', 'crise', 'disproportion', 'affect', 'poor', 'communiti', 'covid', 'polic', 'violenc']"
1244000953302474753,2020-03-28 20:38:34,Standard Tweet,"With the support of the @sunrisemvmt, we’ll make sure to continue transforming the local and national conversations on climate change.

I’m ready to take this fight to Washington. Can I count on your support in that fight?  Donate before our deadline!
https://t.co/ajdmQ4u8hl",Jamaal Bowman,JamaalBowmanNY,1138076821533155328,87,310,['https://secure.actblue.com/donate/jamaal-sunrise-movement?refcode=03282020-tw-post&amount=28'],[],"[{'screen_name': 'sunrisemvmt', 'name': 'Sunrise Movement 🌅', 'id': 1880725393, 'id_str': '1880725393', 'indices': [24, 36]}]",,[],,,,,,,,,[],[],,,[],,,,,,04Oct20_155111,sunrisemvmt well sure continue transforming local national conversations ready fight count fight donate deadline,"['sunrisemvmt', 'well', 'sure', 'continu', 'transform', 'local', 'nation', 'convers', 'readi', 'fight', 'count', 'fight', 'donat', 'deadlin']"
1242918152440352768,2020-03-25 20:55:54,RT of QT,"Joe Biden citing a Green New Deal as part of ongoing stimulus packages is a pretty big deal in terms of where the policy response to this crisis is going to head within the Democratic Party.

https://t.co/js5lv6M4c0",Jamaal Bowman,JamaalBowmanNY,1138076821533155328,119,616,['https://twitter.com/PhilipWegmann/status/1242869080773853184'],[],[],,[],1.242875376168325e+18,Wed Mar 25 18:05:55 +0000 2020,Waleed Shahid,_waleedshahid,329115426.0,"Full Quote: ""Thirdly, we're going to have an opportunity, I believe, in the next round here to use the my green economy my Green Deal or be able to generate both economic growth as consistent with the kind of infusion of monies we need into the system to keep it going."" https://t.co/iCdpWY4GUn",26.0,69.0,['https://twitter.com/PhilipWegmann/status/1242865530102562816'],[],[],,[],1.2428690807738532e+18,Wed Mar 25 17:40:54 +0000 2020,Philip Melanchthon Wegmann,PhilipWegmann,591973307.0,04Oct20_155111,joe biden citing green deal ongoing stimulus packages pretty big deal terms policy response crisis going head within democratic party,"['joe', 'biden', 'cite', 'green', 'deal', 'ongo', 'stimulus', 'packag', 'pretti', 'big', 'deal', 'term', 'polici', 'respons', 'crisi', 'go', 'head', 'within', 'democrat', 'parti']"
1240064897104392199,2020-03-17 23:58:05,Standard Tweet,"Thank you to @sunrisemvmtnyc for inviting me to speak to their members last night. Was great to talk to all of you about Environmental Justice, the Green New Deal, and so much more.

I look forward to our next conversation!",Jamaal Bowman,JamaalBowmanNY,1138076821533155328,4,36,[],[],"[{'screen_name': 'sunrisemvmtnyc', 'name': 'Sunrise NYC 🌅', 'id': 925761459606474757, 'id_str': '925761459606474757', 'indices': [13, 28]}]",,[],,,,,,,,,[],[],,,[],,,,,,04Oct20_155111,thank sunrisemvmtnyc inviting speak members last night great environmental justice green deal much forward next conversation,"['thank', 'sunrisemvmtnyc', 'invit', 'speak', 'member', 'last', 'night', 'great', 'environment', 'justic', 'green', 'deal', 'much', 'forward', 'next', 'convers']"
1304927057042866183,2020-09-12 23:37:09,Retweet,"""Millennials, and Gen z, and all these folks that come after us, are looking up and we're like 'the world will end in 12 years if we don't address climate change, and your biggest issue is how are we gonna pay for it?'"" @AOC #MLKNow #MLK2019 https://t.co/fbUxr2C0tJ",Mondaire Jones,MondaireJones,872143958847045632,372,1126,[],"['MLKNow', 'MLK2019']","[{'screen_name': 'AOC', 'name': 'Alexandria Ocasio-Cortez', 'id': 138203134, 'id_str': '138203134', 'indices': [220, 224]}]",video,['http://pbs.twimg.com/ext_tw_video_thumb/1087443548536954880/pu/img/8P4D1Sk7igRJ8Rf8.jpg'],1.0874437805657825e+18,Mon Jan 21 20:16:15 +0000 2019,People for Bernie,People4Bernie,3141672447.0,,,,[],[],,,[],,,,,,04Oct20_155116,millennials gen z folks come looking world end 12 years address biggest issue gonna pay aoc mlknow mlk2019,"['millenni', 'gen', 'folk', 'come', 'look', 'world', 'end', 'year', 'address', 'biggest', 'issu', 'gonna', 'pay', 'aoc', 'mlknow', 'mlk2019']"
1248610847250767874,2020-04-10 13:56:38,Retweet,"Thanks to @cameron_kasky for having me on to discuss where the progressive movement goes from here. 
 
From Medicare for All, to a Green New Deal, to CJ Reform, Americans are embracing ideas that were considered radical a few years ago. 

Keep organizing, including in NY-17. ✊🏿 https://t.co/pp2JodYOcd",Mondaire Jones,MondaireJones,872143958847045632,12,131,[],[],"[{'screen_name': 'cameron_kasky', 'name': 'Cam', 'id': 964032914626359296, 'id_str': '964032914626359296', 'indices': [10, 24]}]",video,['http://pbs.twimg.com/ext_tw_video_thumb/1248414225044627457/pu/img/pw3GuVTM80RjE5IB.jpg'],1.2484143021359677e+18,Fri Apr 10 00:55:38 +0000 2020,Mondaire Jones,MondaireJones,8.721439588470456e+17,,,,[],[],,,[],,,,,,04Oct20_155120,thanks cameron_kasky discuss progressive movement goes medicare green deal cj reform americans embracing ideas considered radical years keep organizing ny17,"['thank', 'cameron_kaski', 'discuss', 'progress', 'movement', 'goe', 'medicar', 'green', 'deal', 'cj', 'reform', 'american', 'embrac', 'idea', 'consid', 'radic', 'year', 'keep', 'organ', 'ny17']"
