1244675906465148928,2020-03-30 17:20:35,Standard Tweet,"🚨🚨ENDORSEMENT ALERT🚨🚨

@sunrisemvmtpgh endorses Emily Kinkead for State Representative, District 20. The Sunrise Movement engages young people in fighting to stop the climate crisis and supports progressive environmental champions running for office.

1/2 https://t.co/rybbTlkXnI",Emily Kinkead for State Representative District 20,emily4pa20,1183444071244881920,3,15,[],[],"[{'screen_name': 'sunrisemvmtpgh', 'name': 'Sunrise Movement Pittsburgh 🌍🔥', 'id': 1177362128631517185, 'id_str': '1177362128631517185', 'indices': [23, 38]}]",photo,['http://pbs.twimg.com/media/EUX4r1VWoAA9itW.jpg'],,,,,,,,,[],[],,,[],,,,,,20Oct20_143135,endorsement alert sunrisemvmtpgh endorses emily kinkead representative 20 sunrise movement engages young people fighting stop crisis supports progressive environmental champions running office 12,"['endors', 'alert', 'sunrisemvmtpgh', 'endors', 'emili', 'kinkead', 'repres', 'sunris', 'movement', 'engag', 'young', 'peopl', 'fight', 'stop', 'crisi', 'support', 'progress', 'environment', 'champion', 'run', 'offic']"
1234341935743143937,2020-03-02 04:57:05,Retweet,canvassing for @SummerForPA with @Innamo 💚 #peopleoverpolluters #actonclimate #badassery https://t.co/teDrVieul2,Sara InnamoVOTEo 🌙🦇,Innamo,22261364,5,31,[],"['peopleoverpolluters', 'actonclimate', 'badassery']","[{'screen_name': 'SummerForPA', 'name': 'Summer Lee', 'id': 917389190328877056, 'id_str': '917389190328877056', 'indices': [15, 27]}, {'screen_name': 'Innamo', 'name': 'Sara InnamoVOTEo 🌙🦇', 'id': 22261364, 'id_str': '22261364', 'indices': [33, 40]}]",photo,['http://pbs.twimg.com/media/ESEnmSNXYAEZSNL.jpg'],1.2343113153778074e+18,Mon Mar 02 02:55:24 +0000 2020,Katie masks - it's the new sexy accessory,katdawblu,874720140.0,,,,[],[],,,[],,,,,,20Oct20_143139,canvassing summerforpa innamo peopleoverpolluters actonclimate badassery,"['canvass', 'summerforpa', 'innamo', 'peopleoverpollut', 'actonclim', 'badasseri']"
1314018267653124097,2020-10-08 01:42:22,Quote Tweet,Climate justice cannot wait. It's time we invest in clean energy job creation and support sustainable solutions for environmental justice communities. #VPDebate #AskAboutClimate https://t.co/kmPqqnmJuM,Marlene Katz for State Representative,MarleneKatz4PA,1186672350328184832,1,2,['https://twitter.com/ConservationPA/status/1313983197810696192'],"['VPDebate', 'AskAboutClimate']",[],,[],1.3139831978106962e+18,Wed Oct 07 23:23:01 +0000 2020,Conservation Voters of PA,ConservationPA,108102397.0,"Hey #BucksCounty! We just wrapped thousands of voters about Marlene Katz (@marlenekatz4pa), Harold Hayes (@HowieHayesPA), Gary Spillane (@electspillane) &amp; Ann Marie Mitchell (@annmarie4pa). Learn more about their commitment to environmental issues: https://t.co/woWIDBxoOL https://t.co/jA6aFX0BG0",2.0,10.0,['https://bit.ly/2GzI4LZ'],['BucksCounty'],"[{'screen_name': 'MarleneKatz4PA', 'name': 'Marlene Katz for State Representative', 'id': 1186672350328184832, 'id_str': '1186672350328184832', 'indices': [74, 89]}, {'screen_name': 'HowieHayesPA', 'name': 'Howie Hayes', 'id': 1227298425605181440, 'id_str': '1227298425605181440', 'indices': [106, 119]}, {'screen_name': 'electspillane', 'name': 'Elect Gary Spillane', 'id': 1242487926996467713, 'id_str': '1242487926996467713', 'indices': [137, 151]}, {'screen_name': 'AnnMarie4PA', 'name': 'Ann Marie Mitchell for State Representative', 'id': 1219804092790386689, 'id_str': '1219804092790386689', 'indices': [179, 191]}]",photo,['http://pbs.twimg.com/media/Ejw0wSDWoAEhF8d.jpg'],,,,,,20Oct20_143206,justice cannot wait time invest clean energy job creation sustainable solutions environmental justice communities vpdebate askaboutclimate,"['justic', 'cannot', 'wait', 'time', 'invest', 'clean', 'energi', 'job', 'creation', 'sustain', 'solut', 'environment', 'justic', 'communiti', 'vpdebat', 'askaboutclim']"
1298049623026806790,2020-08-25 00:08:41,Quote Tweet,"Thank you @ConservationPA for this very important endorsement. Pennsylvania needs legislators who are committed to solving environmental issues and you count on me to combat climate change, and fight for pro-environmental policy. #cleanenergy #cleanair https://t.co/QWm6UzmSjb",Marlene Katz for State Representative,MarleneKatz4PA,1186672350328184832,3,9,['https://twitter.com/ConservationPA/status/1297932689564196866'],"['cleanenergy', 'cleanair']","[{'screen_name': 'ConservationPA', 'name': 'Conservation Voters of PA', 'id': 108102397, 'id_str': '108102397', 'indices': [10, 25]}]",,[],1.2979326895641969e+18,Mon Aug 24 16:24:02 +0000 2020,Conservation Voters of PA,ConservationPA,108102397.0,"We’re excited to endorse Marlene Katz for State Representative (@marlenekatz4pa)!
Learn more about Marlene and why we’re thrilled to endorse her &gt;&gt; https://t.co/KKljrw4tZu https://t.co/WShC7BHWof",1.0,6.0,['https://bit.ly/31o8vf3'],[],"[{'screen_name': 'MarleneKatz4PA', 'name': 'Marlene Katz for State Representative', 'id': 1186672350328184832, 'id_str': '1186672350328184832', 'indices': [64, 79]}]",photo,['http://pbs.twimg.com/media/EgMu5n7WAAEuQui.jpg'],,,,,,20Oct20_143207,thank conservationpa important endorsement needs legislators committed solving environmental issues count combat fight proenvironmental policy cleanenergy cleanair,"['thank', 'conservationpa', 'import', 'endors', 'need', 'legisl', 'commit', 'solv', 'environment', 'issu', 'count', 'combat', 'fight', 'proenvironment', 'polici', 'cleanenergi', 'cleanair']"
1260600695176286208,2020-05-13 16:00:01,Standard Tweet,"Have you heard Lissa’s plan to address climate change yet? Check out her bold plan at https://t.co/lcQVPZEvnh. If you’d like to hear more, join us today at 7 PM for our environmental town hall with Rep. Sara Innamorato! RSVP here: https://t.co/lmeb0udH5S",Lissa for PA,LissaforPA,2285865500,1,5,"['http://lissaforpa.com/environment', 'http://lissaforpa.com/envirotownhall']",[],[],,[],,,,,,,,,[],[],,,[],,,,,,20Oct20_143210,heard lissas plan address yet check bold plan youd hear 7 environmental town hall sara innamorato rsvp,"['heard', 'lissa', 'plan', 'address', 'yet', 'check', 'bold', 'plan', 'youd', 'hear', 'environment', 'town', 'hall', 'sara', 'innamorato', 'rsvp']"
1194275135261466625,2019-11-12 15:25:55,Standard Tweet,"Climate denial isn't just a Republican, global warning-is-a-hoax thing.  Believing we have time to correct course after we profit a little more is also climate denial. And it's bi-partisan.",Summer Lee,SummerForPA,917389190328877056,48,154,[],[],[],,[],,,,,,,,,[],[],,,[],,,,,,20Oct20_143217,denial isnt republican global warningisahoax believing time correct course profit little denial bipartisan,"['denial', 'isnt', 'republican', 'global', 'warningisahoax', 'believ', 'time', 'correct', 'cours', 'profit', 'littl', 'denial', 'bipartisan']"
1273661366482669568,2020-06-18 16:58:27,Reply Tweet,"The problems all of us face - lack of healthcare, impacts of climate change, gun violence, etc - disproportionately impact disabled people, which means that as our state representative, I’d work even harder to solve those problems for everyone!",Jessica Benham,jessicalbenham,3038460374,1,15,[],[],[],,[],1.273661363831931e+18,,,jessicalbenham,3038460374.0,,,,[],[],,,[],,,,,,20Oct20_143225,problems face lack healthcare impacts gun violence etc disproportionately impact disabled people means representative work even harder solve problems everyone,"['problem', 'face', 'lack', 'healthcar', 'impact', 'gun', 'violenc', 'etc', 'disproportion', 'impact', 'disabl', 'peopl', 'mean', 'repres', 'work', 'even', 'harder', 'solv', 'problem', 'everyon']"
1225248329627525121,2020-02-06 02:42:20,Standard Tweet,"Endorsement alert: Sunrise Movement

John will be a climate champion. He understands that incrementalism lacks the ability to save our future and our planet! We need 100% clean &amp; renewable energy now ! John plans to… https://t.co/H2Sgz7DmfE",John Padora for State Representative,padora4PA,1155670942108045314,0,2,['https://www.instagram.com/p/B8NYSk9pDm0/?igshid=kphmimxw7m7t'],[],[],,[],,,,,,,,,[],[],,,[],,,,,,20Oct20_143234,endorsement alert sunrise movement john champion understands incrementalism lacks ability save future planet 100 clean renewable energy john plans,"['endors', 'alert', 'sunris', 'movement', 'john', 'champion', 'understand', 'increment', 'lack', 'abil', 'save', 'futur', 'planet', 'clean', 'renew', 'energi', 'john', 'plan']"
1214182574450511872,2020-01-06 13:50:58,Reply Tweet,"With your help, we will elevate the voices and needs of all people in the face of an increasingly divisive political climate that distracts us from the duties that Auditor General is tasked with..",Scott Conklin,conklinforpa,1213585214355562496,0,4,[],[],[],,[],1.214182573368365e+18,,,conklinforpa,1.2135852143555625e+18,,,,[],[],,,[],,,,,,20Oct20_143256,help elevate voices needs people face increasingly divisive political distracts duties auditor general tasked,"['help', 'elev', 'voic', 'need', 'peopl', 'face', 'increas', 'divis', 'polit', 'distract', 'duti', 'auditor', 'general', 'task']"
1298843521554751488,2020-08-27 04:43:21,Retweet,"Hurricane Laura is heading directly for Lake Charles, Louisiana, a majority Black city with metro area population of 225,000.

The per capita income is $22,855.

This is the crossroads of the climate emergency and environmental racism of the oil industry. 
https://t.co/VaiFmwxkoy",Julie Gobble,Julie4Texas,1183935768911368192,4665,7561,['https://www.earthisland.org/journal/index.php/articles/entry/last-man-standing/'],[],[],,[],1.2986481444906598e+18,Wed Aug 26 15:47:00 +0000 2020,Eric Holthaus,EricHolthaus,290180065.0,,,,[],[],,,[],,,,,,20Oct20_141303,hurricane laura heading directly lake charles majority black city metro area population 225000 per capita income 22855 crossroads emergency environmental racism oil industry,"['hurrican', 'laura', 'head', 'direct', 'lake', 'charl', 'major', 'black', 'citi', 'metro', 'area', 'popul', 'per', 'capita', 'incom', 'crossroad', 'emerg', 'environment', 'racism', 'oil', 'industri']"
1321212306844487682,2020-10-27 22:08:55,Retweet,"🌳💧Climate change is real. I’m proud to earn the support of the @TexasSierraClub, and look forward to continuing the fight to protect our environment for our future generations. 🌎 #txlege #VoteEarly https://t.co/iyGeFlLcwj",Rafael Anchía,RafaelAnchia,17025489,3,16,[],"['txlege', 'VoteEarly']","[{'screen_name': 'TexasSierraClub', 'name': 'Texas Sierra Club', 'id': 71805880, 'id_str': '71805880', 'indices': [63, 79]}]",video,['http://pbs.twimg.com/ext_tw_video_thumb/1321129235495505920/pu/img/rQXXtpZNwHB2z9a3.jpg'],1.321129246815867e+18,Tue Oct 27 16:38:52 +0000 2020,Rafael Anchía,RafaelAnchia,17025489.0,,,,[],[],,,[],,,,,,03Nov20_130235,real proud earn texassierraclub forward continuing fight protect environment future generations voteearly,"['real', 'proud', 'earn', 'texassierraclub', 'forward', 'continu', 'fight', 'protect', 'environ', 'futur', 'generat', 'voteear']"
1209605603460562946,2019-12-24 22:43:43,Standard Tweet,"I believe in science. Global warming, perhaps? Christmas in Texas. Feliz Noche Buena! https://t.co/PDvTFA2cIK",Victoria Neave,Victoria4Texas,3272287644,10,49,[],[],[],photo,['http://pbs.twimg.com/media/EMlh4lGWsAA29Or.jpg'],,,,,,,,,[],[],,,[],,,,,,20Oct20_142021,believe science global warming perhaps christmas feliz noche buena,"['believ', 'scienc', 'global', 'warm', 'perhap', 'christma', 'feliz', 'noch', 'buena']"
1304498824002625537,2020-09-11 19:15:30,Standard Tweet,"👋  I'm the future rep for #TXHD112.  Introduce me to your followers w/ a RT! To address climate change, I know energy modernization is essential. Green jobs are the jobs of today and tomorrow. I don’t work by candlelight or travel by horse and buggy. Do you? https://t.co/3ZjVnV4PH0",Brandy K. Chambers,BrandyforTexas,833436521059479552,10,22,[],['TXHD112'],[],photo,['http://pbs.twimg.com/media/Ehp7F04XsAAUw-o.jpg'],,,,,,,,,[],[],,,[],,,,,,20Oct20_142048,future txhd112 introduce followers w rt address know energy modernization essential green jobs jobs tomorrow work candlelight travel horse buggy,"['futur', 'txhd112', 'introduc', 'follow', 'rt', 'address', 'know', 'energi', 'modern', 'essenti', 'green', 'job', 'job', 'tomorrow', 'work', 'candlelight', 'travel', 'hors', 'buggi']"
1287100996905086977,2020-07-25 19:02:45,Standard Tweet,"A Climate Plan in Texas Focuses on Minorities. Not Everyone Likes It. - The New York Times

#txlege  https://t.co/3VQG1Iu8wT",Armando Walle,RepWalle,574185893,0,3,['https://www.nytimes.com/2020/07/24/climate/houston-flooding-race.html'],['txlege'],[],,[],,,,,,,,,[],[],,,[],,,,,,20Oct20_142325,plan focuses minorities everyone likes york times,"['plan', 'focus', 'minor', 'everyon', 'like', 'york', 'time']"
1225627985761505280,2020-02-07 03:50:57,Retweet,@evanasmith @KiahCollier Some patterns in underlying attitudes toward climate change among under-40 Republican voters. https://t.co/gk7mU9iBjz https://t.co/6D8YhUcYeV,Gina Hinojosa,GinaForAustin,737131740,3,4,['https://texaspolitics.utexas.edu/blog/glacial-shift-republican-attitudes-toward-climate-change-masks-significant-differences-between'],[],"[{'screen_name': 'evanasmith', 'name': 'Evan Smith', 'id': 18791654, 'id_str': '18791654', 'indices': [0, 11]}, {'screen_name': 'KiahCollier', 'name': 'Kiah Collier', 'id': 114523205, 'id_str': '114523205', 'indices': [12, 24]}]",photo,"['http://pbs.twimg.com/media/EQGTYZ6X0AEh6Tt.jpg', 'http://pbs.twimg.com/media/EQGTYZ8W4AEkJti.jpg', 'http://pbs.twimg.com/media/EQGTYZ7WoAE36MU.jpg']",1.2254226386354176e+18,Thu Feb 06 14:14:58 +0000 2020,Jim Henson,jamesrhenson,49758766.0,,,,[],[],,,[],,,,,,20Oct20_141549,evanasmith kiahcollier patterns underlying attitudes toward among under40 republican voters,"['evanasmith', 'kiahcolli', 'pattern', 'under', 'attitud', 'toward', 'among', 'under40', 'republican', 'voter']"
1224733546788655105,2020-02-04 16:36:46,Standard Tweet,"TX emits more CO2 than any other US state! Over 1/2 of these emissions are related to the industrial sector, which includes energy-intensive industries like petroleum refining &amp; manufacturing. The 2nd largest contributor is our transpo sector. Learn more: https://t.co/fkGFSsFaqD https://t.co/mhzU59QWxN",Gina Hinojosa,GinaForAustin,737131740,7,7,['https://bit.ly/2ujxfYa'],[],[],photo,['http://pbs.twimg.com/media/EP8gq0LX4AE6Iuf.jpg'],,,,,,,,,[],[],,,[],,,,,,20Oct20_141549,emits co2 12 emissions related industrial sector includes energyintensive industries petroleum refining manufacturing 2nd largest contributor transpo sector learn,"['emit', 'co2', 'emiss', 'relat', 'industri', 'sector', 'includ', 'energyintens', 'industri', 'petroleum', 'refin', 'manufactur', 'nd', 'largest', 'contributor', 'transpo', 'sector', 'learn']"
1237160989482725377,2020-03-09 23:38:59,Retweet,".@cristinafortexas endorses @RoyceWestTX vs. @mjhegar in Democratic U.S. Senate runoff. Tzintzún Ramirez says he’s ‘consistent’ on abortion rights, guns, immigration, climate change. #txlege #2020Elections https://t.co/S83YE0GZ5d",Michelle Beckley,ForHD65,831693852146806784,9,9,[],"['txlege', '2020Elections']","[{'screen_name': 'RoyceWestTX', 'name': 'Royce West', 'id': 1151934548747403264, 'id_str': '1151934548747403264', 'indices': [28, 40]}, {'screen_name': 'mjhegar', 'name': 'MJ Hegar', 'id': 3021460584, 'id_str': '3021460584', 'indices': [45, 53]}]",photo,['http://pbs.twimg.com/media/ESr7S1JWoAEMKbB.jpg'],1.237077356541612e+18,Mon Mar 09 18:06:40 +0000 2020,Bob Garrett,RobertTGarrett,48523902.0,,,,[],[],,,[],,,,,,20Oct20_141725,cristinafortexas endorses roycewesttx vs mjhegar democratic senate runoff tzintzún ramirez says hes consistent abortion rights guns immigration 2020elections,"['cristinafortexa', 'endors', 'roycewesttx', 'vs', 'mjhegar', 'democrat', 'senat', 'runoff', 'tzintzún', 'ramirez', 'say', 'hes', 'consist', 'abort', 'right', 'gun', 'immigr', 'elect']"
1236454766185795586,2020-03-08 00:52:43,Standard Tweet,"What do people in HD83 think about climate &amp; clean jobs?
In the counties that make up this district, 60% of constituents know that climate change is
happening. 76% believe we should fund research in renewable energy &amp; 63%
believe we should regulate carbon dioxide as a pollutant",Addison Perry-Franks For Texas HD83,addison4tx,26858372,1,4,[],[],[],,[],,,,,,,,,[],[],,,[],,,,,,20Oct20_141828,people hd83 think clean jobs counties 60 constituents know happening 76 believe fund research renewable energy 63 believe regulate carbon dioxide pollutant,"['peopl', 'hd83', 'think', 'clean', 'job', 'counti', 'constitu', 'know', 'happen', 'believ', 'fund', 'research', 'renew', 'energi', 'believ', 'regul', 'carbon', 'dioxid', 'pollut']"
1305946202236690433,2020-09-15 19:06:52,Standard Tweet,"I’m honored to be featured on the #ClimateCabinet40 list of highest impact climate races. Wisconsinites have made it clear they’re ready for a clean energy future- and I promise to prioritize #ClimateAction from day one. 

Learn more &amp; chip in here ⬇️
https://t.co/dekGbBjnEt https://t.co/SLQV5B89HT","Sara Rodriguez 😷 MSN, MPH, RN",sara4WI,1255606504645943296,5,8,['https://secure.actblue.com/donate/unseat_rob_hutton?refcode=candidate'],"['ClimateCabinet40', 'ClimateAction']",[],photo,['http://pbs.twimg.com/media/Eh-nJfxWoAA9WzF.jpg'],,,,,,,,,[],[],,,[],,,,,,20Oct20_143703,honored featured climatecabinet40 list highest impact races wisconsinites made clear theyre ready clean energy future promise prioritize climateaction learn chip,"['honor', 'featur', 'climatecabinet40', 'list', 'highest', 'impact', 'race', 'wisconsinit', 'made', 'clear', 'theyr', 'readi', 'clean', 'energi', 'futur', 'promis', 'priorit', 'climateact', 'learn', 'chip']"
1279943619001147393,2020-07-06 01:01:53,Retweet,"This Tuesday at 6 pm, I’ll be hosting the third virtual listening session of the Governor's Task Force on Climate Change via Zoom! My fellow task force members and I want to hear about how climate change is impacting your life. Join here ➡️ https://t.co/FF40GmWKuI https://t.co/82JmywDXh6",Deb Andraca for WI State Assembly,debforwi,1195917270926663680,29,73,['http://bit.ly/ListeningSession3'],[],[],photo,['http://pbs.twimg.com/media/EcMcFJRXkAAODNl.jpg'],1.2798975976631583e+18,Sun Jul 05 21:59:01 +0000 2020,Lt. Governor Mandela Barnes,LGMandelaBarnes,1.0758662194656379e+18,,,,[],[],,,[],,,,,,20Oct20_143730,tuesday 6 hosting third virtual listening session governors task force zoom fellow task force members want hear impacting life,"['tuesday', 'host', 'third', 'virtual', 'listen', 'session', 'governor', 'task', 'forc', 'zoom', 'fellow', 'task', 'forc', 'member', 'want', 'hear', 'impact', 'life']"
1235219133584879619,2020-03-04 15:02:45,Standard Tweet,"those on “the left” who’ve been paternalistically telling us big ideas like #Medicare4All &amp; a #GreenNewDeal are impractical pie in the sky are feeling a nice sense of accomplishment &amp; pride today. 

Imagine being content with that nice feeling...imagine that making you happy",John Rocco Calabrese,jroccocal,758801311072518144,1,2,[],"['Medicare4All', 'GreenNewDeal']",[],,[],,,,,,,,,[],[],,,[],,,,,,20Oct20_143748,left whove paternalistically telling big ideas medicare4all greennewdeal impractical pie sky feeling nice sense accomplishment pride imagine content nice feelingimagine making happy,"['left', 'whove', 'paternalist', 'tell', 'big', 'idea', 'medicare4al', 'greennewd', 'impract', 'pie', 'sky', 'feel', 'nice', 'sens', 'accomplish', 'pride', 'imagin', 'content', 'nice', 'feelingimagin', 'make', 'happi']"
1194937284509999104,2019-11-14 11:17:04,Retweet,It has been really cold for almost three weeks in a row. Does that mean that climate change is a myth? NO. We just happen to be in the area of the world that is most below average right now. Notice all the areas of orange and red. Those are areas that are above average. https://t.co/EIoVjtM0sl,Elizabeth Lochner Abel,liz4wisconsin,1173552179082383360,75,361,[],[],[],photo,['http://pbs.twimg.com/media/EJTNbp2X0AM1hEL.png'],1.1948056803199304e+18,Thu Nov 14 02:34:07 +0000 2019,Mark Baden,Mark_Baden,474414285.0,,,,[],[],,,[],,,,,,20Oct20_143806,really cold almost three weeks row mean myth happen area world average right notice areas orange red areas average,"['realli', 'cold', 'almost', 'three', 'week', 'row', 'mean', 'myth', 'happen', 'area', 'world', 'averag', 'right', 'notic', 'area', 'orang', 'red', 'area', 'averag']"
1308591378809663491,2020-09-23 02:17:51,Retweet,"@NotARealWookiee @StLuGal @akbarjenkins @EnglishTeach07 For instance, economists broadly support some fairly tough action on climate change. This statement has been signed by 3500+ economists, including some very notable ones, and proposes a very tough and redistributive climate policy:

https://t.co/lQwgjmB8v9",Joel Jacobsen,JoelforWI,1264903395233546240,4,13,['https://www.econstatement.org'],[],"[{'screen_name': 'NotARealWookiee', 'name': '💧Pete B', 'id': 908807031544438784, 'id_str': '908807031544438784', 'indices': [0, 16]}, {'screen_name': 'StLuGal', 'name': 'StLuGal', 'id': 414973382, 'id_str': '414973382', 'indices': [17, 25]}, {'screen_name': 'akbarjenkins', 'name': 'Alex Sayf Cummings🌹', 'id': 21364868, 'id_str': '21364868', 'indices': [26, 39]}, {'screen_name': 'EnglishTeach07', 'name': 'Jess Piper', 'id': 2491804962, 'id_str': '2491804962', 'indices': [40, 55]}]",,[],1.3084891891142205e+18,Tue Sep 22 19:31:47 +0000 2020,John Carolin 🔰,JohnCarolin,39491148.0,,,,[],[],,,[],,,,,,20Oct20_143916,notarealwookiee stlugal akbarjenkins englishteach07 instance economists broadly fairly tough action statement signed 3500 economists notable ones proposes tough redistributive policy,"['notarealwookie', 'stlugal', 'akbarjenkin', 'englishteach07', 'instanc', 'economist', 'broad', 'fair', 'tough', 'action', 'statement', 'sign', 'economist', 'notabl', 'one', 'propos', 'tough', 'redistribut', 'polici']"
1295801826391003136,2020-08-18 19:16:44,Retweet,"I am so excited to join Ashley Biden, @GretaNeubauer, @DavidFBowen, @Hong4Assembly, Bella Fuentes, &amp; @DJCassidy for a Youth Vote &amp; Climate Action happy hour! We'll be talking about the importance of young Wisconsinites to elect Democrats. Sign up now! 🎧🍻https://t.co/zGkr7r2EB9",Greta Neubauer,gretaneubauer,870478135120232448,4,24,['https://bit.ly/3iQPSXl'],[],"[{'screen_name': 'gretaneubauer', 'name': 'Greta Neubauer', 'id': 870478135120232448, 'id_str': '870478135120232448', 'indices': [38, 52]}, {'screen_name': 'DavidFBowen', 'name': 'Rep. David F. Bowen', 'id': 610320045, 'id_str': '610320045', 'indices': [54, 66]}, {'screen_name': 'Hong4assembly', 'name': 'Francesca Hong', 'id': 269377464, 'id_str': '269377464', 'indices': [68, 82]}, {'screen_name': 'DJCassidy', 'name': 'DJ Cassidy', 'id': 20010462, 'id_str': '20010462', 'indices': [105, 115]}]",,[],1.295737991747588e+18,Tue Aug 18 15:03:05 +0000 2020,Sarah Godlewski,SarahforWI,4018919237.0,,,,[],[],,,[],,,,,,20Oct20_143921,excited ashley biden gretaneubauer davidfbowen hong4assembly bella fuentes djcassidy youth vote action happy hour well talking importance young wisconsinites elect democrats sign,"['excit', 'ashley', 'biden', 'gretaneubau', 'davidfbowen', 'hong4assembl', 'bella', 'fuent', 'djcassidi', 'youth', 'vote', 'action', 'happi', 'hour', 'well', 'talk', 'import', 'young', 'wisconsinit', 'elect', 'democrat', 'sign']"
1290477771202805761,2020-08-04 02:40:51,Retweet,"Join @SunriseMadison1, @ycatw, and us for a Youth Vote Climate Rally with @nada4wisconsin, D8 Alder @mcprestigiacomo, and Climate Justice Activist @vict_barrett! The event will be live-streamed this Wednesday, August 5th at 5:00 PM CT.

RSVP here: https://t.co/Bs4BIUAWK6 https://t.co/9JTBsSqRhr",Francesca Hong,Hong4assembly,269377464,4,8,['http://bit.ly/climaterally85'],[],"[{'screen_name': 'SunriseMadison1', 'name': 'Sunrise Madison🌅', 'id': 1211372600108048384, 'id_str': '1211372600108048384', 'indices': [5, 21]}, {'screen_name': 'ycatw', 'name': 'youth climate action team', 'id': 1101348367916040192, 'id_str': '1101348367916040192', 'indices': [23, 29]}, {'screen_name': 'mcprestigiacomo', 'name': 'Max Prestigiacomo #8ToAbolition', 'id': 2562863985, 'id_str': '2562863985', 'indices': [100, 116]}, {'screen_name': 'vict_barrett', 'name': 'Vic J. Barrett', 'id': 4329166468, 'id_str': '4329166468', 'indices': [147, 160]}]",photo,['http://pbs.twimg.com/media/Eehv_HiWAAgzkV-.jpg'],1.290404426935685e+18,Mon Aug 03 21:49:24 +0000 2020,Young Progressives of UW-Madison,yoprowisco,221637650.0,,,,[],[],,,[],,,,,,20Oct20_143933,sunrisemadison1 ycatw youth vote rally nada4wisconsin d8 alder mcprestigiacomo justice activist vict_barrett event livestreamed wednesday august 5th 500 rsvp,"['sunrisemadison1', 'ycatw', 'youth', 'vote', 'ralli', 'nada4wisconsin', 'd8', 'alder', 'mcprestigiacomo', 'justic', 'activist', 'vict_barrett', 'event', 'livestream', 'wednesday', 'august', 'th', 'rsvp']"
